{
  "$schema": "../docs/reference/schemas/documentation/control-plane.schema.json",
  "schema": "openslack.control_plane.v1",
  "updated": "2026-08-02",
  "authorities": [
    {
      "fact": "project.portfolio-state",
      "canonical": "memory_bank/control-plane.json#/portfolio",
      "projections": ["memory_bank/t0_core/current_state.md", "production/project-roadmap.md"],
      "indexes": ["memory_bank/README.md"]
    },
    {
      "fact": "project.release-state",
      "canonical": "memory_bank/control-plane.json#/release",
      "projections": ["memory_bank/t0_core/release_state.md"]
    },
    {
      "fact": "project.work-plan-and-execution-mirror",
      "canonical": "memory_bank/control-plane.json#/assignments",
      "projections": [
        "memory_bank/t2_execution/current_roadmap.md",
        "production/project-roadmap.md"
      ]
    },
    {
      "fact": "product.module-runtime-telemetry",
      "canonical": ".openslack/modules.yaml",
      "projections": ["docs/status/current.md"]
    },
    {
      "fact": "documentation.authority-map",
      "canonical": "memory_bank/control-plane.json#/authorities",
      "indexes": ["docs/README.md"]
    },
    {
      "fact": "delivery.evidence-index",
      "canonical": "docs/evidence/README.md",
      "indexes": [
        "memory_bank/t3_archive/qa_evidence_index.md",
        "memory_bank/t3_archive/reviews/review-index.md"
      ]
    },
    {
      "fact": "product.design-map",
      "canonical": "design/cdd/module-index.md",
      "indexes": ["docs/architecture/traceability-matrix.md"]
    },
    {
      "fact": "project.support-map",
      "canonical": "memory_bank/control-plane.json#/support"
    },
    {
      "fact": "governance.memory-bank-consolidation",
      "canonical": "memory_bank/control-plane.json#/migrations/memoryBankConsolidation"
    }
  ],
  "documents": [
    {
      "id": "qa-cleanup-permit-2026-09-21",
      "path": "production/qa/qa-plan-cleanup-permit-2026-09-21.md",
      "status": "active"
    },
    {
      "id": "qa-ledger-cleanup-post420-2026-10-11",
      "path": "production/qa/qa-ledger-cleanup-post420-2026-10-11.md",
      "status": "active"
    },
    {
      "id": "qa-ledger-harness-pr426-2026-10-27",
      "path": "production/qa/qa-ledger-harness-pr426-2026-10-27.md",
      "status": "active"
    },
    {
      "id": "qa-ledger-harness-r36-2026-10-28",
      "path": "production/qa/qa-ledger-harness-r36-2026-10-28.md",
      "status": "active"
    },
    {
      "id": "service-cleanup-broker",
      "path": "services/cleanup-broker/README.md",
      "status": "active"
    },
    {
      "id": "architecture-task-claim-v2-c0",
      "path": "docs/architecture/contracts/task-claim-v2-c0.md",
      "status": "active"
    },
    {
      "id": "cdd-module-index",
      "path": "design/cdd/module-index.md",
      "status": "active"
    },
    {
      "id": "cdd-module-collaboration",
      "path": "design/cdd/modules/collaboration.md",
      "status": "active"
    },
    {
      "id": "cdd-module-github-task-loop",
      "path": "design/cdd/modules/github-task-loop.md",
      "status": "active"
    },
    {
      "id": "cdd-module-operator",
      "path": "design/cdd/modules/operator.md",
      "status": "active"
    },
    {
      "id": "cdd-module-pr-review-merge",
      "path": "design/cdd/modules/pr-review-merge.md",
      "status": "active"
    },
    {
      "id": "cdd-module-self-evolution",
      "path": "design/cdd/modules/self-evolution.md",
      "status": "active"
    },
    {
      "id": "cdd-product-concept",
      "path": "design/cdd/product-concept.md",
      "status": "active"
    },
    {
      "id": "cdd-agent-conversations",
      "path": "design/cdd/workstreams/agent-runtime-and-aby/agent-conversations.md",
      "status": "active"
    },
    {
      "id": "cdd-agent-teams",
      "path": "design/cdd/workstreams/agent-runtime-and-aby/agent-teams.md",
      "status": "active"
    },
    {
      "id": "cdd-agent-work-units",
      "path": "design/cdd/workstreams/agent-runtime-and-aby/agent-work-units.md",
      "status": "active"
    },
    {
      "id": "cdd-workstream-agent-runtime-and-aby",
      "path": "design/cdd/workstreams/agent-runtime-and-aby/README.md",
      "status": "active"
    },
    {
      "id": "cdd-workstream-negentropy-integration",
      "path": "design/cdd/workstreams/negentropy-integration/README.md",
      "status": "active"
    },
    {
      "id": "cdd-workstream-notification-delivery",
      "path": "design/cdd/workstreams/notification-delivery/README.md",
      "status": "active"
    },
    {
      "id": "cdd-workstream-organization-graph",
      "path": "design/cdd/workstreams/organization-graph/README.md",
      "status": "active"
    },
    {
      "id": "cdd-workstream-plugin-platform",
      "path": "design/cdd/workstreams/plugin-platform/README.md",
      "status": "active"
    },
    {
      "id": "cdd-workstream-profile-sync",
      "path": "design/cdd/workstreams/profile-sync/README.md",
      "status": "active"
    },
    {
      "id": "cdd-workstream-qoder-work",
      "path": "design/cdd/workstreams/qoder-work/README.md",
      "status": "active"
    },
    {
      "id": "cdd-workstream-scenario-runtime",
      "path": "design/cdd/workstreams/scenario-runtime/README.md",
      "status": "active"
    },
    {
      "id": "cdd-workstream-tui-productization",
      "path": "design/cdd/workstreams/tui-productization/README.md",
      "status": "active"
    },
    {
      "id": "cdd-workflow-dynamic-ux-closure",
      "path": "design/cdd/workstreams/workflow-runtime/dynamic-workflow-ux-closure.md",
      "status": "active"
    },
    {
      "id": "cdd-workstream-workflow-runtime",
      "path": "design/cdd/workstreams/workflow-runtime/README.md",
      "status": "active"
    },
    {
      "id": "cdd-workflow-format-analysis",
      "path": "design/cdd/workstreams/workflow-runtime/workflow-format-analysis.md",
      "status": "active"
    },
    {
      "id": "cdd-workflow-modules",
      "path": "design/cdd/workstreams/workflow-runtime/workflow-modules.md",
      "status": "active"
    },
    {
      "id": "ux-product-roadmap",
      "path": "design/ux/product-roadmap.md",
      "status": "active"
    },
    {
      "id": "architecture-adr-single-root-memory-bank",
      "path": "docs/architecture/adr/adr-0001-single-root-memory-bank.md",
      "status": "active"
    },
    {
      "id": "architecture-adr-multi-go-service-workspace",
      "path": "docs/architecture/adr/adr-0002-multi-go-service-workspace.md",
      "status": "active"
    },
    {
      "id": "architecture-adr-harness-closed-loop-repair",
      "path": "docs/architecture/adr/adr-0003-harness-closed-loop-repair.md",
      "status": "active"
    },
    {
      "id": "architecture-adr-run-storage-recovery",
      "path": "docs/architecture/adr/adr-0004-run-storage-recovery.md",
      "status": "active"
    },
    {
      "id": "architecture-adr-index",
      "path": "docs/architecture/adr/README.md",
      "status": "index"
    },
    {
      "id": "architecture-master",
      "path": "docs/architecture/architecture.md",
      "status": "active"
    },
    {
      "id": "architecture-ts-to-go-migration-roadmap",
      "path": "docs/architecture/ts-to-go-migration-roadmap.md",
      "status": "active"
    },
    {
      "id": "architecture-agent-runtime",
      "path": "docs/architecture/components/agent-runtime.md",
      "status": "active"
    },
    {
      "id": "architecture-collaboration",
      "path": "docs/architecture/components/collaboration.md",
      "status": "active"
    },
    {
      "id": "architecture-github-task-loop",
      "path": "docs/architecture/components/github-task-loop.md",
      "status": "active"
    },
    {
      "id": "architecture-mcp-runtime-lifecycle",
      "path": "docs/architecture/components/mcp-runtime-lifecycle.md",
      "status": "active"
    },
    {
      "id": "architecture-operator",
      "path": "docs/architecture/components/operator.md",
      "status": "active"
    },
    {
      "id": "architecture-pr-review-merge",
      "path": "docs/architecture/components/pr-review-merge.md",
      "status": "active"
    },
    {
      "id": "architecture-components-index",
      "path": "docs/architecture/components/README.md",
      "status": "index"
    },
    {
      "id": "architecture-repository-pr-projection",
      "path": "docs/architecture/components/repository-pr-projection.md",
      "status": "active"
    },
    {
      "id": "architecture-self-evolution-kernel",
      "path": "docs/architecture/components/self-evolution-kernel.md",
      "status": "active"
    },
    {
      "id": "architecture-subagent-runtime",
      "path": "docs/architecture/components/subagent-runtime.md",
      "status": "active"
    },
    {
      "id": "architecture-workflow-runtime",
      "path": "docs/architecture/components/workflow-runtime.md",
      "status": "active"
    },
    {
      "id": "contract-collaboration-events",
      "path": "docs/architecture/contracts/collaboration-events.md",
      "status": "active"
    },
    {
      "id": "contract-organization-graph",
      "path": "docs/architecture/contracts/organization-graph.md",
      "status": "active"
    },
    {
      "id": "contract-governance-control",
      "path": "docs/architecture/contracts/governance-control.md",
      "status": "active"
    },
    {
      "id": "contract-qoder-mcp",
      "path": "docs/architecture/contracts/qoder-mcp.md",
      "status": "active"
    },
    {
      "id": "contract-workflow-control",
      "path": "docs/architecture/contracts/workflow-control.md",
      "status": "active"
    },
    {
      "id": "contract-workflow-runner",
      "path": "docs/architecture/contracts/workflow-runner.md",
      "status": "active"
    },
    {
      "id": "architecture-contracts-index",
      "path": "docs/architecture/contracts/README.md",
      "status": "index"
    },
    {